{
	"$schema": "https://json-schema.org/draft/2020-12/schema",
	"$id": "https://github.com/mabzadev/superboard/blob/dev/schemas/superboard-brand.schema.json",
	"title": "SuperBoard brand contract",
	"type": "object",
	"additionalProperties": false,
	"required": [
		"$schema",
		"schemaVersion",
		"brand",
		"repositories",
		"developmentDomains",
		"sdkStrategy",
		"cloudflareMigration"
	],
	"properties": {
		"$schema": {
			"const": "./superboard-brand.schema.json"
		},
		"schemaVersion": {
			"const": 3
		},
		"brand": {
			"type": "object",
			"additionalProperties": false,
			"required": ["name", "slug", "namespace"],
			"properties": {
				"name": {
					"const": "SuperBoard"
				},
				"slug": {
					"const": "superboard"
				},
				"namespace": {
					"const": "superboard"
				}
			}
		},
		"repositories": {
			"type": "object",
			"additionalProperties": false,
			"required": ["canonical", "layout", "legacyReadOnly"],
			"properties": {
				"canonical": {
					"const": "mabzadev/superboard"
				},
				"layout": {
					"type": "object",
					"additionalProperties": false,
					"required": ["platform", "reference"],
					"properties": {
						"platform": {
							"const": "."
						},
						"reference": {
							"const": "apps/reference"
						}
					}
				},
				"legacyReadOnly": {
					"const": ["mabzadev/superboard-platform", "mabzadev/superboard-reference"]
				}
			}
		},
		"developmentDomains": {
			"type": "object",
			"additionalProperties": false,
			"required": ["dashboard", "reference", "shortLinks"],
			"properties": {
				"dashboard": {
					"const": "board.mabza.dev"
				},
				"reference": {
					"const": "reference.mabza.dev"
				},
				"shortLinks": {
					"const": "in.mabza.dev"
				}
			}
		},
		"sdkStrategy": {
			"type": "object",
			"additionalProperties": false,
			"required": ["active", "internal", "archived"],
			"properties": {
				"active": {
					"const": ["flutter", "flutterflow"]
				},
				"internal": {
					"const": ["android", "ios"]
				},
				"archived": {
					"const": ["flutterflow-support", "javascript", "react-native"]
				}
			}
		},
		"cloudflareMigration": {
			"type": "object",
			"additionalProperties": false,
			"required": [
				"canonicalWorkerPrefix",
				"persistentResourcePolicy",
				"canonicalEnvironmentPrefix"
			],
			"properties": {
				"canonicalWorkerPrefix": {
					"const": "superboard"
				},
				"persistentResourcePolicy": {
					"const": "retain-physical-name-until-verified-cutover"
				},
				"canonicalEnvironmentPrefix": {
					"const": "SUPERBOARD_"
				}
			}
		}
	}
}
